attribution,count,positive_count,negative_count,positive_ratio
Memorial Sloan Kettering Cancer Center,129068,174,128894,0.001348
"Department of Dermatology, Hospital Clínic de Barcelona",105724,72,105652,0.000681
University Hospital of Basel,65218,13,65205,0.000199
"Frazer Institute, The University of Queensland, Dermatology Research Centre",51768,81,51687,0.001565
ACEMID MIA,28665,33,28632,0.001151
"ViDIR Group, Department of Dermatology, Medical University of Vienna",12640,14,12626,0.001108
"Department of Dermatology, University of Athens, Andreas Syggros Hospital of Skin and Venereal Diseases, Alexander Stratigos, Konstantinos Liopyris",7976,6,7970,0.000752
